{
  "schema_version": "1",
  "seed_run": "",
  "emphasis": "AWS delivery automation: GitHub Actions, Terraform and Docker",
  "headline": {
    "text": "Junior DevOps Engineer \u00b7 AWS \u00b7 Terraform \u00b7 GitHub Actions",
    "source_refs": [
      "basics",
      "exp-1"
    ]
  },
  "summary": {
    "text": "Junior DevOps engineer who automates AWS deployments with Terraform, Docker and GitHub Actions, and keeps services observable with Prometheus and Grafana. AWS Certified Cloud Practitioner.",
    "source_refs": [
      "sum-1",
      "exp-1",
      "cert-1"
    ]
  },
  "skills": [
    {
      "label": "Cloud & Containers",
      "priority": 1,
      "items": [
        {
          "name": "AWS",
          "source_refs": []
        },
        {
          "name": "ECS",
          "source_refs": []
        },
        {
          "name": "S3",
          "source_refs": []
        },
        {
          "name": "IAM",
          "source_refs": []
        },
        {
          "name": "Docker",
          "source_refs": []
        },
        {
          "name": "Helm",
          "source_refs": []
        }
      ]
    },
    {
      "label": "Infrastructure & CI/CD",
      "priority": 2,
      "items": [
        {
          "name": "Terraform",
          "source_refs": []
        },
        {
          "name": "GitHub Actions",
          "source_refs": []
        },
        {
          "name": "Git",
          "source_refs": []
        },
        {
          "name": "Linux",
          "source_refs": []
        }
      ]
    },
    {
      "label": "Scripting",
      "priority": 3,
      "items": [
        {
          "name": "Python",
          "source_refs": []
        },
        {
          "name": "Bash",
          "source_refs": []
        },
        {
          "name": "PowerShell",
          "source_refs": []
        }
      ]
    },
    {
      "label": "Monitoring & Operations",
      "priority": 3,
      "items": [
        {
          "name": "Prometheus",
          "source_refs": []
        },
        {
          "name": "Grafana",
          "source_refs": []
        },
        {
          "name": "CloudWatch",
          "source_refs": []
        },
        {
          "name": "PagerDuty",
          "source_refs": []
        },
        {
          "name": "runbooks",
          "source_refs": []
        }
      ]
    }
  ],
  "experience": [
    {
      "profile_id": "exp-1",
      "priority": 1,
      "intro": {
        "mode": "none",
        "text": "",
        "source_refs": []
      },
      "bullets": [
        {
          "op": "keep",
          "from": [
            "exp-1.b1"
          ],
          "text": "",
          "extra_refs": [],
          "priority": 1
        },
        {
          "op": "rewrite",
          "from": [
            "exp-1.b2"
          ],
          "text": "Replaced manual console changes across 3 environments with Terraform modules and Kubernetes manifests for AWS networking and ECS services.",
          "extra_refs": [],
          "priority": 1
        },
        {
          "op": "keep",
          "from": [
            "exp-1.b3"
          ],
          "text": "",
          "extra_refs": [],
          "priority": 2
        },
        {
          "op": "attested",
          "from": [
            "exp-1.b3"
          ],
          "text": "Packaged two internal services with Helm.",
          "extra_refs": [
            "att-001"
          ],
          "priority": 2
        },
        {
          "op": "rewrite",
          "from": [
            "exp-1.b4"
          ],
          "text": "Built Prometheus and Grafana dashboards and alerts, reducing mean time to detect incidents by about 40%.",
          "extra_refs": [],
          "priority": 2
        },
        {
          "op": "keep",
          "from": [
            "exp-1.b5"
          ],
          "text": "",
          "extra_refs": [],
          "priority": 3
        }
      ],
      "engagements": []
    },
    {
      "profile_id": "exp-2",
      "priority": 3,
      "intro": {
        "mode": "none",
        "text": "",
        "source_refs": []
      },
      "bullets": [
        {
          "op": "keep",
          "from": [
            "exp-2.b1"
          ],
          "text": "",
          "extra_refs": [],
          "priority": 5
        },
        {
          "op": "keep",
          "from": [
            "exp-2.b2"
          ],
          "text": "",
          "extra_refs": [],
          "priority": 3
        }
      ],
      "engagements": []
    }
  ],
  "earlier_experience": {
    "include": false,
    "profile_ids": []
  },
  "certifications": [
    {
      "profile_id": "cert-1",
      "short_name": "",
      "priority": 2
    }
  ],
  "education": [
    {
      "profile_id": "edu-1",
      "include_details": false
    }
  ],
  "talking_points": [
    {
      "text": "Walk through the GitHub Actions pipelines: 12 services, deploy time from 25 minutes to 8 minutes.",
      "source_refs": [
        "exp-1.b1"
      ]
    },
    {
      "text": "Be ready to explain the Helm packaging of two internal services in depth, since it is new to the CV.",
      "source_refs": [
        "att-001"
      ]
    }
  ],
  "omitted": [
    {
      "profile_id": "exp-1.b6",
      "reason": "Tools line is covered by the skills section."
    },
    {
      "profile_id": "exp-2.b3",
      "reason": "Least relevant to the JD."
    }
  ],
  "open_items": [
    {
      "kind": "gap",
      "text": "Python and Bash are listed in Skills only; no bullet cites them.",
      "item_ids": [
        "skl-2"
      ]
    },
    {
      "kind": "source_issue",
      "text": "The IT Support Intern role overlaps the BSc end date by 2 months.",
      "item_ids": [
        "iss-1"
      ]
    }
  ]
}
